admin10_school3_district_district3_2,school3,Special Education Director/Assistant Elementary Principal,I have completed the survey for each listed teacher.,3,3,3,3,3,Lower Middle Quartile (26th to 50th percentile),3,6,6,6,6,Upper Middle Quartile (51st to 75th percentile),1,3,3,3,3,Lower Middle Quartile (26th to 50th percentile),2,4 = Average,4 = Average,4 = Average,4 = Average,Upper Middle Quartile (51st to 75th percentile),3,4 = Average,4 = Average,4 = Average,4 = Average,Lower Middle Quartile (26th to 50th percentile),3,5,5,5,5,Upper Middle Quartile (51st to 75th percentile),2,3,3,3,3,Lower Middle Quartile (26th to 50th percentile),3,6,6,6,6,Upper Middle Quartile (51st to 75th percentile),3,6,6,6,6,Upper Middle Quartile (51st to 75th percentile),3,4 = Average,4 = Average,4 = Average,4 = Average,Upper Middle Quartile (51st to 75th percentile),3,6,6,6,6,Upper Middle Quartile (51st to 75th percentile),3,4 = Average,4 = Average,4 = Average,4 = Average,Upper Middle Quartile (51st to 75th percentile),3,7 = Exceptional,7 = Exceptional,7 = Exceptional,7 = Exceptional,Top Quartile (76th to 100th percentile),2,4 = Average,4 = Average,4 = Average,4 = Average,Upper Middle Quartile (51st to 75th percentile),3,5,5,5,5,Lower Middle Quartile (26th to 50th percentile),3,6,6,6,6,Upper Middle Quartile (51st to 75th percentile),3,4 = Average,4 = Average,4 = Average,4 = Average,Lower Middle Quartile (26th to 50th percentile),3,6,6,6,6,Upper Middle Quartile (51st to 75th percentile),3,7 = Exceptional,7 = Exceptional,7 = Exceptional,7 = Exceptional,Top Quartile (76th to 100th percentile),3,5,5,5,5,Upper Middle Quartile (51st to 75th percentile),,,,,,,,,,,,,,,,,,,,,,,,,No,,,,,,,,,,,,,,,,,,,,,,,,,,,,,,,,,,,,,,,
Please confirm that this is your name,Please confirm that this your school,"Please identify your current role in the school. If you work in multiple roles, please identify your primary role.",Select a teacher for submitting a review,"This school year, how many times have you observed teacher_61_school1_district1_1 instruction?","Based on your knowledge of the teacher and their instruction, please rate them on the following characteristics from 1 = “Needs Improvement” to 7 = “Exceptional”. [Overall, how effective is the teacher in delivering high-quality math instruction?]","Based on your knowledge of the teacher and their instruction, please rate them on the following characteristics from 1 = “Needs Improvement” to 7 = “Exceptional”. [How effective is the teacher in supporting students to build conceptual understanding of mathematical ideas?]","Based on your knowledge of the teacher and their instruction, please rate them on the following characteristics from 1 = “Needs Improvement” to 7 = “Exceptional”. [How effective is the teacher in delivering math content that reaches all students?]","Based on your knowledge of the teacher and their instruction, please rate them on the following characteristics from 1 = “Needs Improvement” to 7 = “Exceptional”. [How effective is the teacher in connecting with students as individuals and with their lives and cultures outside of the classroom?]","Based on your entire roster of teachers whom you work, which quartile of overall effectiveness does the teacher fall into? Choose one.","This school year, how many times have you observed teacher_67_school1_district1_1's instruction?","Based on your knowledge of the teacher and their instruction, please rate them on the following characteristics from 1 = “Needs Improvement” to 7 = “Exceptional”. [Overall, how effective is the teacher in delivering high-quality math instruction?]","Based on your knowledge of the teacher and their instruction, please rate them on the following characteristics from 1 = “Needs Improvement” to 7 = “Exceptional”. [How effective is the teacher in supporting students to build conceptual understanding of mathematical ideas?]","Based on your knowledge of the teacher and their instruction, please rate them on the following characteristics from 1 = “Needs Improvement” to 7 = “Exceptional”. [How effective is the teacher in delivering math content that reaches all students?]","Based on your knowledge of the teacher and their instruction, please rate them on the following characteristics from 1 = “Needs Improvement” to 7 = “Exceptional”. [How effective is the teacher in connecting with students as individuals and with their lives and cultures outside of the classroom?]","Based on your entire roster of teachers whom you work, which quartile of overall effectiveness does the teache fall into? Choose one.","This school year, how many times have you observed teacher_57_school1_district1_1 instruction?","Based on your knowledge of the teacher and their instruction, please rate them on the following characteristics from 1 = “Needs Improvement” to 7 = “Exceptional”. [Overall, how effective is the teacher in delivering high-quality math instruction?]","Based on your knowledge of the teacher and their instruction, please rate them on the following characteristics from 1 = “Needs Improvement” to 7 = “Exceptional”. [How effective is the teacher in supporting students to build conceptual understanding of mathematical ideas?]","Based on your knowledge of the teacher and their instruction, please rate them on the following characteristics from 1 = “Needs Improvement” to 7 = “Exceptional”. [How effective is the teacher in delivering math content that reaches all students?]","Based on your knowledge of the teacher and their instruction, please rate them on the following characteristics from 1 = “Needs Improvement” to 7 = “Exceptional”. [How effective is the teacher in connecting with students as individuals and with their lives and cultures outside of the classroom?]","Based on your entire roster of teachers whom you work, which quartile of overall effectiveness does the teacher's fall into? Choose one.","This school year, how many times have you observed teacher_1_school1_district1_1 instruction?","Based on your knowledge of the teacher and their instruction, please rate them on the following characteristics from 1 = “Needs Improvement” to 7 = “Exceptional”. [Overall, how effective is the teacher in delivering high-quality math instruction?]","Based on your knowledge of the teacher and their instruction, please rate them on the following characteristics from 1 = “Needs Improvement” to 7 = “Exceptional”. [How effective is the teacher in supporting students to build conceptual understanding of mathematical ideas?]","Based on your knowledge of the teacher and their instruction, please rate them on the following characteristics from 1 = “Needs Improvement” to 7 = “Exceptional”. [How effective is the teacher in delivering math content that reaches all students?]","Based on your knowledge of the teacher and their instruction, please rate them on the following characteristics from 1 = “Needs Improvement” to 7 = “Exceptional”. [How effective is the teacher in connecting with students as individuals and with their lives and cultures outside of the classroom?]","Based on your entire roster of teachers whom you work, which quartile of overall effectiveness does the teacher fall into? Choose one.",Is there a teacher who is participating in the Teaching Lab program this spring but is not named in this survey?,Please enter the name of the teacher,"This school year, how many times have you observed the teacher's instruction?","Based on your knowledge of the teacher and their instruction, please rate them on the following characteristics from 1 = “Needs Improvement” to 7 = “Exceptional”. [Overall, how effective is the teacher in delivering high-quality math instruction?]","Based on your knowledge of the teacher and their instruction, please rate them on the following characteristics from 1 = “Needs Improvement” to 7 = “Exceptional”. [How effective is the teacher in supporting students to build conceptual understanding of mathematical ideas?]","Based on your knowledge of the teacher and their instruction, please rate them on the following characteristics from 1 = “Needs Improvement” to 7 = “Exceptional”. [How effective is the teacher in delivering math content that reaches all students?]","Based on your knowledge of the teacher and their instruction, please rate them on the following characteristics from 1 = “Needs Improvement” to 7 = “Exceptional”. [How effective is the teacher in connecting with students as individuals and with their lives and cultures outside of the classroom?]","Based on your entire roster of teachers whom you work, which quartile of overall effectiveness does the teacher fall into? Choose one.",Is there a teacher who is participating in the Teaching Lab program this spring but is not named in this survey?,Please enter the name of the teacher,"This school year, how many times have you observed the teacher's instruction?","Based on your knowledge of the teacher and their instruction, please rate them on the following characteristics from 1 = “Needs Improvement” to 7 = “Exceptional”. [Overall, how effective is the teacher in delivering high-quality math instruction?]","Based on your knowledge of the teacher and their instruction, please rate them on the following characteristics from 1 = “Needs Improvement” to 7 = “Exceptional”. [How effective is the teacher in supporting students to build conceptual understanding of mathematical ideas?]","Based on your knowledge of the teacher and their instruction, please rate them on the following characteristics from 1 = “Needs Improvement” to 7 = “Exceptional”. [How effective is the teacher in delivering math content that reaches all students?]","Based on your knowledge of the teacher and their instruction, please rate them on the following characteristics from 1 = “Needs Improvement” to 7 = “Exceptional”. [How effective is the teacher in connecting with students as individuals and with their lives and cultures outside of the classroom?]","Based on your entire roster of teachers whom you work, which quartile of overall effectiveness does the teacher fall into? Choose one.",Is there a teacher who is participating in the Teaching Lab program this spring but is not named in this survey?,Please enter the name of the teacher,"This school year, how many times have you observed the teacher's instruction?","Based on your knowledge of the teacher and their instruction, please rate them on the following characteristics from 1 = “Needs Improvement” to 7 = “Exceptional”. [Overall, how effective is the teacher in delivering high-quality math instruction?]","Based on your knowledge of the teacher and their instruction, please rate them on the following characteristics from 1 = “Needs Improvement” to 7 = “Exceptional”. [How effective is the teacher in supporting students to build conceptual understanding of mathematical ideas?]","Based on your knowledge of the teacher and their instruction, please rate them on the following characteristics from 1 = “Needs Improvement” to 7 = “Exceptional”. [How effective is the teacher in delivering math content that reaches all students?]","Based on your knowledge of the teacher and their instruction, please rate them on the following characteristics from 1 = “Needs Improvement” to 7 = “Exceptional”. [How effective is the teacher in connecting with students as individuals and with their lives and cultures outside of the classroom?]","Based on your entire roster of teachers whom you work, which quartile of overall effectiveness does the teacher fall into? Choose one.",Is there a teacher who is participating in the Teaching Lab program this spring but is not named in this survey?,Please enter the name of the teacher,"This school year, how many times have you observed the teacher's instruction?","Based on your knowledge of the teacher and their instruction, please rate them on the following characteristics from 1 = “Needs Improvement” to 7 = “Exceptional”. [Overall, how effective is the teacher in delivering high-quality math instruction?]","Based on your knowledge of the teacher and their instruction, please rate them on the following characteristics from 1 = “Needs Improvement” to 7 = “Exceptional”. [How effective is the teacher in supporting students to build conceptual understanding of mathematical ideas?]","Based on your knowledge of the teacher and their instruction, please rate them on the following characteristics from 1 = “Needs Improvement” to 7 = “Exceptional”. [How effective is the teacher in delivering math content that reaches all students?]","Based on your knowledge of the teacher and their instruction, please rate them on the following characteristics from 1 = “Needs Improvement” to 7 = “Exceptional”. [How effective is the teacher in connecting with students as individuals and with their lives and cultures outside of the classroom?]","Based on your entire roster of teachers whom you work, which quartile of overall effectiveness does the teacher fall into? Choose one.",Is there a teacher who is participating in the Teaching Lab program this spring but is not named in this survey?,Please enter the name of the teacher,"This school year, how many times have you observed the teacher's instruction?","Based on your knowledge of the teacher and their instruction, please rate them on the following characteristics from 1 = “Needs Improvement” to 7 = “Exceptional”. [Overall, how effective is the teacher in delivering high-quality math instruction?]","Based on your knowledge of the teacher and their instruction, please rate them on the following characteristics from 1 = “Needs Improvement” to 7 = “Exceptional”. [How effective is the teacher in supporting students to build conceptual understanding of mathematical ideas?]","Based on your knowledge of the teacher and their instruction, please rate them on the following characteristics from 1 = “Needs Improvement” to 7 = “Exceptional”. [How effective is the teacher in delivering math content that reaches all students?]","Based on your knowledge of the teacher and their instruction, please rate them on the following characteristics from 1 = “Needs Improvement” to 7 = “Exceptional”. [How effective is the teacher in connecting with students as individuals and with their lives and cultures outside of the classroom?]","Based on your entire roster of teachers whom you work, which quartile of overall effectiveness does the teacher fall into? Choose one.",NULL,NULL,NULL,,,,,,NULL,,,,,,NULL,,,,,,NULL,NULL,NULL,NULL,NULL,,NULL,NULL,NULL,NULL,NULL,,NULL,,,,,,NULL,NULL,NULL,NULL,NULL,,NULL,,,,,,NULL,NULL,NULL,NULL,NULL,,,,,,,,,,,,,,,,,,,,,,,,,,,,,,,,,,,,,,,,,,,,,,,,,,,,,,,,,,,,,,,,,
teacher_69_school1_district1_1,school1,Principal,I have completed the survey for each listed teacher.,2,6,6,5,7 = Exceptional,Upper Middle Quartile (51st to 75th percentile),3,3,3,3,7 = Exceptional,Lower Middle Quartile (26th to 50th percentile),4,7 = Exceptional,6,5,7 = Exceptional,Top Quartile (76th to 100th percentile),2,3,3,3,4 = Average,Bottom Quartile (1st to 25th percentile),No,NULL,NULL,NULL,NULL,,NULL,NULL,NULL,NULL,NULL,,NULL,NULL,NULL,NULL,NULL,,NULL,NULL,NULL,NULL,NULL,,NULL,NULL,NULL,NULL,NULL,,NULL,,NULL,NULL,,NULL,NULL,NULL,NULL,NULL,NULL,NULL,NULL,,,,,,NULL,,,,,,NULL,,,,,,NULL,NULL,NULL,NULL,NULL,,NULL,NULL,NULL,NULL,NULL,,NULL,,,,,,NULL,NULL,NULL,NULL,NULL,,NULL,,,,,,NULL,NULL,NULL,NULL,NULL,,,,,,,,,,,,,,,,,,,,,,,,,,,,,,,,,,,,,,,,,,,,,,,,,,,,,,,,,,,,,,,,,
Please confirm that this is your name,Please confirm that this your school,"Please identify your current role in the school. If you work in multiple roles, please identify your primary role.",Select a teacher for submitting a review,"This school year, how many times have you observed teacher_53_school8_district8_1 instruction?","Based on your entire roster of teachers whom you work, which quartile of overall effectiveness does the teacher's fall into? Choose one.","Based on your knowledge of the teacher and their instruction, please rate them on the following characteristics from 1 = “Needs Improvement” to 7 = “Exceptional”. [Overall, how effective is the teacher in delivering high-quality math instruction?]","Based on your knowledge of the teacher and their instruction, please rate them on the following characteristics from 1 = “Needs Improvement” to 7 = “Exceptional”. [How effective is the teacher in supporting students to build conceptual understanding of mathematical ideas?]","Based on your knowledge of the teacher and their instruction, please rate them on the following characteristics from 1 = “Needs Improvement” to 7 = “Exceptional”. [How effective is the teacher in delivering math content that reaches all students?]","Based on your knowledge of the teacher and their instruction, please rate them on the following characteristics from 1 = “Needs Improvement” to 7 = “Exceptional”. [How effective is the teacher in connecting with students as individuals and with their lives and cultures outside of the classroom?]","This school year, how many times have you observed teacher_49_school8_district8_1's instruction?","Based on your entire roster of teachers whom you work, which quartile of overall effectiveness does the teache fall into? Choose one.","Based on your knowledge of the teacher and their instruction, please rate them on the following characteristics from 1 = “Needs Improvement” to 7 = “Exceptional”. [Overall, how effective is the teacher in delivering high-quality math instruction?]","Based on your knowledge of the teacher and their instruction, please rate them on the following characteristics from 1 = “Needs Improvement” to 7 = “Exceptional”. [How effective is the teacher in supporting students to build conceptual understanding of mathematical ideas?]","Based on your knowledge of the teacher and their instruction, please rate them on the following characteristics from 1 = “Needs Improvement” to 7 = “Exceptional”. [How effective is the teacher in delivering math content that reaches all students?]","Based on your knowledge of the teacher and their instruction, please rate them on the following characteristics from 1 = “Needs Improvement” to 7 = “Exceptional”. [How effective is the teacher in connecting with students as individuals and with their lives and cultures outside of the classroom?]","This school year, how many times have you observed teacher_23_school8_district8_1 instruction?","Based on your entire roster of teachers whom you work, which quartile of overall effectiveness does the teacher fall into? Choose one.","Based on your knowledge of the teacher and their instruction, please rate them on the following characteristics from 1 = “Needs Improvement” to 7 = “Exceptional”. [Overall, how effective is the teacher in delivering high-quality math instruction?]","Based on your knowledge of the teacher and their instruction, please rate them on the following characteristics from 1 = “Needs Improvement” to 7 = “Exceptional”. [How effective is the teacher in supporting students to build conceptual understanding of mathematical ideas?]","Based on your knowledge of the teacher and their instruction, please rate them on the following characteristics from 1 = “Needs Improvement” to 7 = “Exceptional”. [How effective is the teacher in delivering math content that reaches all students?]","Based on your knowledge of the teacher and their instruction, please rate them on the following characteristics from 1 = “Needs Improvement” to 7 = “Exceptional”. [How effective is the teacher in connecting with students as individuals and with their lives and cultures outside of the classroom?]","This school year, how many times have you observed teacher_36_school8_district8_1 instruction?","Based on your entire roster of teachers whom you work, which quartile of overall effectiveness does the teacher fall into? Choose one.","Based on your knowledge of the teacher and their instruction, please rate them on the following characteristics from 1 = “Needs Improvement” to 7 = “Exceptional”. [Overall, how effective is the teacher in delivering high-quality math instruction?]","Based on your knowledge of the teacher and their instruction, please rate them on the following characteristics from 1 = “Needs Improvement” to 7 = “Exceptional”. [How effective is the teacher in supporting students to build conceptual understanding of mathematical ideas?]","Based on your knowledge of the teacher and their instruction, please rate them on the following characteristics from 1 = “Needs Improvement” to 7 = “Exceptional”. [How effective is the teacher in delivering math content that reaches all students?]","Based on your knowledge of the teacher and their instruction, please rate them on the following characteristics from 1 = “Needs Improvement” to 7 = “Exceptional”. [How effective is the teacher in connecting with students as individuals and with their lives and cultures outside of the classroom?]",Is there a teacher who is participating in the Teaching Lab program this spring but is not named in this survey?,NULL,NULL,NULL,NULL,,NULL,NULL,NULL,NULL,NULL,,NULL,NULL,NULL,NULL,NULL,,NULL,NULL,NULL,NULL,NULL,,NULL,NULL,NULL,NULL,NULL,,NULL,,NULL,NULL,,NULL,NULL,NULL,NULL,NULL,NULL,NULL,NULL,,,,,,NULL,,,,,,NULL,,,,,,NULL,NULL,NULL,NULL,NULL,,NULL,NULL,NULL,NULL,NULL,,NULL,,,,,,NULL,NULL,NULL,NULL,NULL,,NULL,,,,,,NULL,NULL,NULL,NULL,NULL,,,,,,,,,,,,,,,,,,,,,,,,,,,,,,,,,,,,,,,,,,,,,,,,,,,,,,,,,,,,,,,,,
admin6_school8_district8_2,school8,Assistant/Vice Principal,,2,Top Quartile (76th to 100th percentile),5,5,5,6,2,Upper Middle Quartile (51st to 75th percentile),5,5,5,5,1,Upper Middle Quartile (51st to 75th percentile),4 = Average,4 = Average,4 = Average,5,2,Lower Middle Quartile (26th to 50th percentile),3,4 = Average,3,3,No,NULL,NULL,NULL,NULL,,NULL,NULL,3,NULL,NULL,,NULL,Upper Middle Quartile (51st to 75th percentile),3,NULL,NULL,,NULL,Lower Middle Quartile (26th to 50th percentile),NULL,NULL,NULL,,NULL,NULL,NULL,NULL,NULL,,NULL,,5,5,4 = Average,5,3,4 = Average,4 = Average,5,2,3,2,4 = Average,No,,,,NULL,,,,,,NULL,,,,,,NULL,NULL,NULL,NULL,NULL,,NULL,NULL,NULL,NULL,NULL,,NULL,,,,,,NULL,NULL,NULL,NULL,NULL,,NULL,,,,,,NULL,NULL,NULL,NULL,NULL,,,,,,,,,,,,,,,,,,,,,,,,,,,,,,,,,,,,,,,,,,,,,,,,,,,,,,,,,,,,,,,,,